"ID","ALLAS_NEVE","ALLAS_LEIRASA","MUNKAKOR_ID","HIRDETO_ID","KAPCSOLAT_ID","DIAK_VALLALHATJA","HELYSZIN_ID","KEZDES_IDOPONTJA","BEREZES"
17,"Test Lead / Test Manager","Location Atlanta, GAJob Title Test Lead / ManagerDuration 6 Months + High possibility of ExtensionRequired Skills: * 4+ years of experience in Software Testing and Quality Assurance.* Good communication skills* Good understanding of Telecom Network* Good knowledge and experience on preparing Test Plan and Test Strategy documents.* Great understanding of Defect detecting, tracking and reporting techniques.* Excellent Logical and Reasoning skills with keen eye to detail.--------------------------------------------------------------------------------------------------------------------------------------------Submit your resume on this position by clicking Apply button on this page or call Utpal @ 973-841-2390 and email: utpal.raj@collabera.com to contact recruiter to discuss details about this position--------------------------------------------------------------------------------------------------------------------------------------------",6,23,23,0,1,22-JÚL.  -28 00.00.00,000000000,273991
18,"Principal Application Analyst-Supply Chain Lawson","VanderHouwen has more jobs you may like!Â  Find them here: http://bit.ly/1RIQfgEÂ PLEASE JOIN OUR TALENT NETWORK: http://bit.ly/vhatalentnetworkÂ Â Joining the Talent Network with VanderHouwen & Associates (VHA) will enhance your job search and application experience. Job listings are mobile-friendly and easy to review, share, or apply. Whether you choose to just leave usÂ your information or apply, we look forward to connecting with you. SummaryOur client seeking an individual who can apply extensive and advanced principles, theories, and concepts to the development of solutions to complex problems with innovation and ingenuity. Expert knowledge of Lawson Supply Chain modules and business practices.Responsibilities Demonstrate service excellence and positive interpersonal relationships in dealing with others, including patients/families/members, employees, managers, medical staff, volunteers, and community members, so that productivity and positive relations are maximized.Act as a system specialist or business consultant on complex projects or system, which can include planning and coordinating large scale projects or tasks across a multi-state enterprise, using cross disciplined team efforts.Provide technical and operational guidance to ensure that installed systems are working effectively and that proposed systems will meet the organizations future needs.Work with users, user groups, and vendors to gather requirements and provide fit gap analysis and effective technical solutions for the business needs.Provide documentation for testing, functional and technical designs and development processes as required by project management methodology.Develop and recommend technical support and software management standards, policies, procedures and strategies.Develop test plans to test application functionality of highly complex applications across multiple modules in support of patches, upgrades, and infrastructure and/or desktop configuration changes.Respond to and resolve reported incidents according to customer support service level agreements.Participate in problem management and troubleshooting teams on major enterprise system issues.Design, implement, evaluate and facilitate systems tests for new applications or enhancements to current applications.Proactively evaluate and make recommendations around adoption of emerging standards. Mentors others regarding integration protocols and processes.Address topics and issues that are both strategic (long term) and operational (immediate) in nature.QualificationsBachelor's degree or equivalent blend of education and experience.Minimum of 10 years functional experience.Proficient in Microsoft Office Products.Proficient in the development and support of integration with other applications.Minimum of 10 years* experience with the Lawson Supply Chain product suite.Qualifications PreferredMaster's Degree.HealthCare Information Services experience.",31,57,13,0,7,22-OKT.  -23 00.00.00,000000000,306753
19,"Messaging Administrator","Genesis10 is actively seeking a Messaging Administrator for a direct hire position within the insurance industry for our client located in Kansas City, MO. Description: Â  * Our client has an exciting opportunity for a Messaging Administrator who would enjoy working for an organization that strives every day to support the public good and make a difference. You will be working in the division responsible for hardware and software infrastructure as well as providing technology resources for regulatory systems and databases. If you hold a Microsoft Certified Engineer or Certified Information Systems Security Professional certification, we want to chat with you. * This position is located in, state-of-the-art offices in the heart of downtown Kansas City which includes great restaurants, and top-notch entertainment venues. This is a full-time position in a positive and flexible environment. Responsibilities: Â  * Providing administration and technical support for Technical Services enterprise backup systems including: + Administering, supporting, and maintaining the Veritas NetBackup Infrastructure. + Administering, supporting, and maintaining the IBM Tivoli Backup Infrastructure. * Providing administration and technical support for the internal e-mail network including: + Microsoft Windows Server 2008, Windows Server 2012, Microsoft Exchange 2013 support. + Administering the SMTP Mail Gateway servers, Mail flow, gateway filter blocks, virus scanning and virus blocks. * Administering and supporting mobile devices and server architecture: + Installing, configuring, and maintaining Mobile Device Management servers and environment. + Setup and configuration of mobile devices. * Providing administration and support of Lyris ListManager server product including: + Microsoft Server administration and troubleshooting of Lyris ListManager server. + Back-end listserver setup and support. * Carrying a pager and responds to it during and outside of normal business hours. The pager will be carried for a week at a time on a rotating basis. * Participating in a support role for national meeting. This includes travel and supporting systems away from the office for over a week at a time at least once a year. Requirements: Â  * Bachelor's degree (B.A. or B.S.) from a four-year college or university and three years' of related experience; or equivalent combination of education and work experience. A minimum of three years' of experience working with Microsoft Active Directory server administration is required. * Must have strong communication skills. * Must have an in-depth knowledge of Microsoft Active Directory administration and replication. * Proficient with server and workstation hardware. * Must have a sound knowledge of desktop and server operating systems (Windows 7, Windows 2008 or 2012 server) and distributed e-mail systems. * Must have very intuitive troubleshooting skills to look at the broad picture (i.e. consider network and server in resolving desktop problems). * Strong understanding of backup software and backup retention policies. * Only W2 candidates will be considered for this position. (no third parties) If you have the described qualifications and are interested in this exciting opportunity, apply today! About Genesis10: Â  Genesis10 is a leading U.S. business and technology consulting firm with hundreds of clients needing proven talent and solutions to power their strategic initiatives. If you are a high performing business or IT professional with solid, referenced experience, we want to meet you. Genesis10 recruiters and delivery professionals are highly accomplished career advocates, who get to know you beyond your resume to position you with the opportunities that fit your skills, experience and aspirations. We have benefit options to fit your needs and a support staff that works with you from placement throughout your engagement - project after project. To learn more about Genesis10 and to view all our available career opportunities, please visit us at www.genesis10.com ""Genesis10 is an Equal Opportunity Employer, M/F/D/V""Â  Start Date: 06/08/2016",14,47,9,0,10,22-AUG.  -22 00.00.00,000000000,634954
20,"Java Architect - Denver, CO - Fulltime","Our client in the healthcare software industry is seeking a Java Architect to join their growing team. Below is the job description, if interested please submit a word resume and the best time and number to reach you to discuss.Title: Java ArchitectLocation: Denver, CO Duration: Fulltime Salary: DOEResponsibilities:Â This person will be working with IT leadership, product owners, and project management to determine the architectural approach and patterns to apply to projects of the highest level of complexity Design solutions that appropriately balance technical elegance, business need, project risk, and cost Guide the development team throughout the lifecycle.10 years of experience in software development including object oriented analysis and design. Prefer Java technology stack, but similar backgrounds such as .Net will be considered3 years of experience in a team lead role3 years of experience in an application architect or solution architect roleExperience with Middle tier development using Java and related technologyWeb application developmentMobile application development on multiple platformData architecture and data movement, including OLTP systems and BI/Data Warehousing scenario",22,18,17,0,21,22-DEC.  -13 00.00.00,000000000,790343
21,"IT Business Analyst","Genesis10 is looking for a Business Analyst for a long-term contract position in Sandy Springs, GA with our Fortune25 financial services industry client. Only W2 candidates will be considered. Description: Â  As a Business Analyst, you will conduct business and technical analysis for process and tool enhancements and ensures operational readiness to satisfy business partner objectives. The Business Analyst will employ a set of tasks and techniques used to work as a liaison among stakeholders and core team members in order to understand the structure, policies and operations of an organization, and to recommend solutions that enable the organization to achieve its goals. Responsibilities: Â  * Business Analysis, Planning and Monitoring * Requirements Management and Communication * Enterprise Analysis * Requirements Analysis * Solution Assessment and Validation * Work with core team members to elicit, organize, document and validate business rules, functional and non-functional requirements * Partner with the product manager to build cohesive release content * Translate stakeholder requests into a set of system features. These in turn are detailed into specifications for functional and nonfunctional requirements * Ensure the functionality, usability, performance and supportability of the requirements * Assess capability gaps and identify new capabilities required by the enterprise to meet the business need * Understand the organizations business and how the technology supports the business * Assess or evaluate the impact of the change the stakeholder is requesting * Translates business needs into technical requirements and ensures all systems support business needs * Ensure the process of reviewing, selecting, and designing the solution is done in a way that maximizes value delivered to stakeholders * Assess defects and issues; determine the business impact and severity of the defect. Conduct analysis and root cause of defect * Facilitate meetings with the direct involvement of both stakeholders and developers to gather feedback on requirements and solution results and to produce the following key deliverables: + Actionable Requirements (Stories) + Process Maps + Gap Analysis + Scenarios and/or use cases + Data Flow Diagrams + Analysis and submission of Change Control Forms Requirements: Â  * 5-7 years' experience in analysis with expertise in different technologies, business areas, application wide analysis, and proposal of solutions * Ability to interpret the domain in order to capture meaningful requirements * Strength in assembling, analyzing, and representing business requirements * In depth experience performing feasibility analysis, scope projects, prioritize deliverables, recommend alternative solutions and project strategies, and engage in negotiations * Responsible for high level implementation plans, data and process models, cost estimating, cost benefits analysis, and return on investments * Experience facilitating workshops such as JAD, RAD, and DRP sessions, etc. * Expert skills in MS Office (Word, Excel, PowerPoint) and strong Visio skills preferred If you have the described qualifications and are interested in this exciting opportunity, please apply! Only W2 candidates can be considered. About Genesis10: Â  Genesis10 is a leading U.S. business and technology consulting firm with hundreds of clients needing proven talent and solutions to power their strategic initiatives. If you are a high performing business or IT professional with solid, referenced experience, we want to meet you. Genesis10 recruiters and delivery professionals are highly accomplished career advocates, who get to know you beyond your resume to position you with the opportunities that fit your skills, experience and aspirations. We have benefit options to fit your needs and a support staff that works with you from placement throughout your engagement - project after project. To learn more about Genesis10 and to view all our available career opportunities, please visit us at www.genesis10.com. ""Genesis10 is an Equal Opportunity Employer, M/F/D/V""Â  Start Date: 06/30/2016",38,38,20,0,19,22-SZEPT.-20 00.00.00,000000000,272901
22,"IT Sales Manager","Great opportunity for driven, energetic IT Sales Professionals in chicago! Our client is a leading Global IT services Provider based in the tech mecca of the world- Silicon Valley & are looking for High energy, IT sales Professionals to join their team in Midwest . The position offers working remotely ! 7-10 yrs IT Services Sales experience.Â  Â Must have a mix of IT Services Project selling (50%) and Staff Augmentation * Â Onsite Placements with direct end clients (50%).Â Â  Â Industry segments preferred in Retail / Manufacturing / Supply Chain / Product Engineering / Mobility. AÂ SALES HUNTER MENTALITY IS A MUST! Must have a proven sales track record of success of carrying a quota of $3- 4.5 Million dollars Competitive Base Salary + Commission !",1,56,19,1,12,22-AUG.  -25 00.00.00,000000000,543704
23,"Sr. Systems Test Engineer (PERM)","Our client is theÂ worldÂs premier voiceÂ andÂ electronic interdealer brokerÂ and theÂ source of global market Â  informationÂ andÂ commentaryÂ forÂ professionalsÂ in theÂ international financial markets. The Group is active in the wholesale markets in interest rates, credit, commodities, foreign exchange and equity derivatives.Our client is currently seeking a Sr. Systems Test EngineerÂ Â for aÂ fulltimeÂ position inÂ Parsippany, NJ.Principal Responsibilities & AccountabilitiesConduct the entire system certification effort for a project with minimal supervision.Serve as the principal system engineer for major test efforts; lead the effort of other system engineers and application testers as requiredRepresent the group in requirement, specification, and design review meetings and contribute constructive feedback to the presenters in the groupÂs area of expertise.Create test tools to perform API level testingPerform Load and Performance Testing for C / C++, Java and Adobe Flash based applications.Create status and test result reports for management and represent the group in status meetings.Estimate certification effort for projects and ad-hoc testing requests.Determine and execute appropriate system-side testing for each project outside of requirements.Build, install and fallback software releases and database schemas in lab environments.Support operations personnel for critical production issues as needed.Write advanced tools and scripts to aid certification efforts and simplify operations procedures.Experience with VM, configuring VM on both Windows and Linux platformsÂ CompetenciesMastery of Solaris and Linux operating systems.Working knowledge of OpenVMS and WindowsAble to install and configure new hardware and software with minimal assistance.Knowledge of Mercury Interactive suite of automated testing tools (LoadRunner/Performance Center, QTP and Quality Center)Working knowledge of TCP/IP and routing protocols.Knowledge of Microsoft Office suite of products.Working knowledge of SQL Â can create ad-hoc queries to verify test results or troubleshoot issues. Oracle DBA-type experience a plus.Programming experience, preferably C/C++, Java and shell scripting.Knowledge of software methodologies (Agile and Scrum)Qualifications & Experience Minimum of bachelor's degree or equivalent in computer science, masterÂs degree preferred.Atleast 4 years relevant experience on Systems testing, Load and Performance testing for C/ C++, JAVA and Adobe Flash based applications4 yearsÂ experience with manual testing.Knowledge of foreign exchange/banking and market data industriesMinimum 7 years of work experience in the Information Technology industry.Working knowledge of de facto industry standard software (Oracle, HP OpenView, etc.) a plus.Knowledge of Networking Concepts is preferable.knowledge on Tervela or any MQ messaging is preferableknowledge on Google protocol buffer (GPB) and FIX/FAST is preferableknowledge on configuring VM on both Windows and Linux platforms",45,13,6,0,20,22-AUG.  -20 00.00.00,000000000,211317
24,"IT Quality Consultant","Genesis10 is seeking an IT Quality Consultant for a 4-month contract-to-hire position with a client in Eden Prairie, MN. Genesis10 provides access to career opportunities with over 40 clients in the Twin Cities. As the #3 ranked firm for Business and IT consulting in Minnesota, we offer a variety of opportunities whether you are looking for contract, contract-to-hire, or permanent positions. Let's connect today! Responsibilities: Â  * Test Planning - Requirement/User Story review, Test Case writing; Gherkin, Feature Files * Test Case Automation - Selenium framework and/or SOAPUI * Test Case Execution - Selenium and/or SOAPUI; Some manual execution may be required * Test Execution status reports * Proactive Communication * Use of Agile principles; likely use of ATDD principles Qualifications: Â  * Automation & Test execution skills that involve coding in Selenium and/or SOAPUI * Communication & team work * Rally for test case and defect management; Agile project management preferred If you have the described qualifications and are interested in this exciting opportunity, apply today! Benefits of Working with Genesis10: Â  As a Genesis10 consultant, we are proud to offer access to the following benefits: * Medical and dental insurance * Bi-weekly payroll * 401k plan * Downtown Minneapolis/St. Paul parking allowance * Delivery Manager for employee support * Successful re-marketing program * Referral program with the opportunity to earn additional income About Genesis10: Â  Genesis10 is a Professional Technology Services Firm providing Staffing, Workforce Optimization and Domestic Outsourcing Solutions. If you are a high performing business or IT professional with solid, referenced experience, we want to meet you. Genesis10 recruiters and delivery professionals are highly accomplished career advocates, who get to know you beyond your resume to position you with the opportunities that fit your skills, experience and aspirations. We have benefit options to fit your needs and a support staff that works with you from placement throughout your engagement - project after project. To learn more about Genesis10 and to view all our available career opportunities, please visit us at www.genesis10.com ""Genesis10 is an Equal Opportunity Employer, M/F/D/V""",48,72,16,0,6,22-SZEPT.-06 00.00.00,000000000,369394
25,"USB Validation Engineer","VanderHouwen has more jobs you may like!Â  Find them here: http://bit.ly/1RIQfgEÂ PLEASE JOIN OUR TALENT NETWORK: http://bit.ly/vhatalentnetworkÂ Â Joining the Talent Network with VanderHouwen & Associates (VHA) will enhance your job search and application experience. Job listings are mobile-friendly and easy to review, share, or apply. Whether you choose to just leave usÂ your information or apply, we look forward to connecting with you. SummaryThis position is part of the Pre-Silicon Emulation/Post-Silicon Validation team and plays a fundamental role in bringing to market next-generation devices for our growing audio business and ensuring that those devices meet customer requirements.ResponsibilitiesDevelop and execute tests on the lab bench per the validation plan during pre-silicon and post-silicon phases of the product to ensure functionality and performance as per the datasheet.Think beyond the datasheet and around design corners to find elusive bugs. Able to think of test cases and customer usage model that may violate the assumptions of designers and systems engineers.Develop automated test framework, regression test suites in MATLAB and/or LabVIEW to optimize validation efficiency.Work with validation peers to implement best practices and continuous improvements to company validation methodologies.Collaborate closely with IC Design engineers, Systems engineers and Application engineers to understand requirements and use cases.Debug analog/digital silicon issues, board issues and Validation software/hardware tools issues.Analyze test results and identify failures/defects using business intelligence tools such as Spotfire.Work with firmware and software engineers to debug USB protocol errors.Validate USB physical layer against standard USB requirements.Develop and work with supporting HW (FPGA, DSP, ARM, 8051, JTAG, debuggers) and SW (C, Assembly, scripts) collaterals.Qualifications RequiredBS in Electrical or Computer Engineering with 5+ years of experience in related field OR MS in Electrical or Computer Engineering with 3+ years of experience in relevant areas in USB validation.Familiarity with scripting/programming languages such as MATLAB, C, Python, LabVIEW or similar.Solid hands-on experience in lab equipment such as oscilloscopes, signal generators, audio analyzers, logic analyzers, spectrum analyzers for measurement and debugging issues.Qualifications PreferredExperience in various automation framework hardware tools (FPGA, DSP, ARM, 8051, JTAG, NI Data Acquisition) or software tools/languages (Scripting languages as MATLAB, C, Python, SQL, test sequencers such as NI Teststand).Solid hands-on experience in lab equipment such as oscilloscopes, protocol analyzers, signal generators, audio analyzers, logic analyzers, spectrum analyzers for measurement and debugging issues.Self-motivated with excellent problem solving skills and attention to detail are highly valued as you will need to understand silicon, board and software interactions.Demonstrated aptitude in system understanding of various industry interface standards such as I2C, SPI, USB, UART, I2S, TDM or high-speed control/data bus as examples.",54,71,21,0,9,22-OKT.  -11 00.00.00,000000000,234296
