"ID","ALLAS_NEVE","ALLAS_LEIRASA","MUNKAKOR_ID","HIRDETO_ID","KAPCSOLAT_ID","DIAK_VALLALHATJA","HELYSZIN_ID","KEZDES_IDOPONTJA","BEREZES"
80,"Technical Recruiter","Genesis10 has a full-time opportunity for a creative and resourceful technical recruiter in New York city. Description: Â  We are looking for a middle to senior level Technical Recruiter for information technology professionals in a perm-placement environment. Responsibilities: Â  * Understand the capabilities, experience, skills, and motivations of talented candidates * Connect those characteristics to clients' business and technology needs * Be familiar with the requirements of diverse business and technical specialties * Build credibility and recommend the right staffing or service solutions Qualifications: Â  * Previous IT recruiting experience in a perm-hire or agency setting * Knowledge of different sourcing techniques for varied requirements * Experience using social media for professional recruiting * Perception and judgment in reviewing resumes and profiles * Talent for matching candidates and requirements * Skill in using behavioral interviewing techniques * Experience in full life cycle recruiting from source to close * A desire to create ongoing professional connections with candidates * Participation in professional associations and groups * A commitment to building relationships outside business hours * The ability to tell good stories that help make the sale If you are a qualified candidate interested in this opportunity, please apply. About Genesis10: Â  Genesis10 is a privately held company founded in 1999 to provide talent and solutions that power our clients' business and technology initiatives. We have proven experience across industries including Financial Services, Communications, Consumer Products, Energy, Healthcare, Insurance, Manufacturing and Technology resulting in an annual growth rate of 19% based on client referrals. Genesis10 has over 2,000 highly talented U.S. consultants working with over 150 clients (85% of which are Fortune 500). Our Recruiting and Delivery Teams are career advocates, who get to know candidates beyond their resume in order to match opportunities with skills, experience and aspirations. To learn more about Genesis10 and to view all our available career opportunities, please visit us at www.genesis10.com. `Genesis10 is an Equal Opportunity Employer, M/F/D/V`Â  Start Date: 07/05/2016",2,22,1,0,9,22-AUG.  -17 00.00.00,000000000,462763
81,"Senior Technical Writer","SENIOR TECHNICAL WRITER REQUIREMENT #16-00879RECRUITER: KADE HYNESJOB LOCATION: CAMDEN, NJ JUNE 7, 2016 Project Description: A resource is required to manage the capture of process documentation (workflows, work instructions, operating procedures) during facilitated work sessions of the project team. This individual will manage all documentation for training and change mgmt. This individual will also be responsible for arranging working sessions across various support groups to complete the initiative. The work and/or project that will be performed: Documentation & Requirements Facilitation: Standard Operating Procedures, Work Instructions, Issue Solutions, Support Matrix Instructions, Process Flows Required Skills: Ability to capture information from working sessions and individual interviews and to develop into the working documents for the organization Must be skilled in Technical Writing, Process Mapping, Facilitation Must be Proficient in Word, Excel, Visio and familiar with OneDrive & SharePoint This 4+ month position starts ASAP. Please E-MAIL your resume (attachment to email) with rate and availability to Kade: kade@alphaconsulting.com",28,24,5,0,25,22-SZEPT.-13 00.00.00,000000000,602764
82,"Sr. Quality Assurance Test Analyst","Genesis10 is actively seeking Sr. QA Test Analyst in support of our client, a Fortune 25 financial institution. These contract to hire positions are located in Plano, TX. All candidates must be able to work on a W2 basis. No third party candidates will be considered. Summary: Â  Conducts end-to-end testing on applications and technology, to ensure that business, technical, functional requirements are being met throughout the SDLC. Executes test scripts based upon test strategy/plans in an effort to identify defects prior to production. Tests may be manual, automated or both. May also include Production Certification which requires manual/automated scripts be executed to certify production health and/or identify post-production defects. Responsibilities: Â  Test Management * Plan, lead, and manage end-to-end test execution to ensure deliverables are on target and business, technical, functional requirements are met. * Understand end-to-end application flow, associated systems, stakeholders and process touch points. * Assign / allocate resources to work during appropriate timelines to meet deliverable dates. * Provide test estimates (and re-estimates) to the team at each appropriate phase. * Ensure compliance of documentation, entry/exit criteria, and role clarity. * Point of contact and escalation for all offshore test related issues.Test Planning * Review all documentation including Business Requirement Documents (BRD), Design documents, Technical Designs (HLD &LLD) or SRS. * Participate in Story Grooming, Sprint Planning , Design reviews * Deliver and review all documentation with testers to ensure complete understanding of goals and requirements. * Issue resolution around Test/Application Teams environments, test process, tools, and resources. * Understand and document each Test/Application Teams environments. * Coordinate with application team to determine and document application test environments. * Document of each Test/Application Teams systems outage times and dates. * Document of each Test/Application Teams systems code migration schedules. Coordinate with application development/environment team for code migration schedulesTest Preparation * Identify regression requirements and assess risks * Work with Onshore Lead to review with project team and business leaders the test plan emphasizing test requirements. * Develop test schedule using WBS (work breakdown structure) and ensure testers are assigned. * Ensure that appropriate Peer and Stakeholder Reviews are completed for Test Plan, Tests, and Risks. * Coordinate with application team to ensure environments are ready and dates are established for code migration.Test Execution and Defect Tracking * Communicate testing conditions to testers (e.g. timeframes have changed, regions changed, environment down, etc.) * Collect all incident reports/metrics and documentation from testers. * Participate in daily status meeting with project management of defects and issues found * Work with Onshore Lead to monitor execution of tests by off-shore testers * Report defects and issues to development through Quality Center / Rally * Assign resolved defect for re-test * Classify type of defect and identify root cause of incident Requirements: Â  * 5+ years of software testing experience and 2+ years as a test lead * Quick learner and self-starter who requires minimal supervision to excel in a dynamic environment * Deep understanding of the software development process * Traceability matrix development / management * Strong knowledge of project management tools such as Quality Center, JIRA, Rally * Proven ability to lead testing projects of all sizes * Prior experience implementing process improvements in support of testing or software development such as risk based testing * Written and verbal communication across all levels from junior members to senior management * Understanding of SQL * Willingness to train/coach/mentor junior resources * Comfortable working in a matrix environment * Self-motivated, requiring minimal oversight. Desired: Â  * Exposure to various platforms and technologies: Java, .Net, C++, Web, Mobile, Mainframe * Software development background and knowledge of database design * Familiarity with modern development approaches like Agile/SCRUM/Lean * Prior experience in automation testing (QTP/Selenium/TOSCA/RIT) * Financial Services experience * Prior experience of working with globally distributed teams * Bachelors' degree in Computer or equivalent professional experience * Extensive experience in Automation Testing using Quick Test Professional (QTP) in development, maintenance and execution of automation scripts, creation of automation framework (Data Driven, keyword, Hybrid), VB Script and Descriptive Programming * Experience in HP Quick Test Professional (QTP) and Quality Center (QC) integration, Rally (Agile) * Experience in automation of data related applications and ETL processes * Skills upgrading scripts from older versions, * Experience in Tosca, Green Hat, IntelliDB, SMARTOMATEIf you have the described qualifications and are interested in this exciting opportunity, apply today! Only W2 candidates will be considered. About Genesis10: Â  Genesis10 is a leading U.S. business and technology consulting firm with hundreds of clients needing proven talent and solutions to power their strategic initiatives. If you are a high performing business or IT professional with solid, referenced experience, we want to meet you. Genesis10 recruiters and delivery professionals are highly accomplished career advocates, who get to know you beyond your resume to position you with the opportunities that fit your skills, experience and aspirations. We have benefit options to fit your needs and a support staff that works with you from placement throughout your engagement - project after project. To learn more about Genesis10 and to view all our available career opportunities, please visit us at www.genesis10.com ""Genesis10 is an Equal Opportunity Employer, M/F/D/V""",47,46,7,0,18,22-OKT.  -04 00.00.00,000000000,564258
83,"Business Systems Analyst III","VanderHouwen has more jobs you may like!Â  Find them here: http://bit.ly/1RIQfgEÂ PLEASE JOIN OUR TALENT NETWORK: http://bit.ly/vhatalentnetworkÂ Â Joining the Talent Network with VanderHouwen & Associates (VHA) will enhance your job search and application experience. Job listings are mobile-friendly and easy to review, share, or apply. Whether you choose to just leave usÂ your information or apply, we look forward to connecting with you.SummaryOur client is looking for a Business Systems Analyst III to join their team.Responsibilities Project planning and communication support - preparing communication materials for project steering committee and Leadership groups.Business Requirements gathering and documentation.Business process analysis, documentation and redesign as needed - including new business and document management processes using PW, as well as PW helpdesk/support flows, external flows, etc.Test planning, including test case identification and as needed test scrip development.Training planning and delivery support, including training materials documentation.Post implementation support as needed.",10,25,11,0,14,22-OKT.  -02 00.00.00,000000000,321194
84,"Automated Test Engineer","Automated Test Engineer 3-5 years of automated testing experience is required. 100% automation, so heavy on Java with Cucumber and Selenium desired. Must have Selenium experience with mobile and web. Communication skills are important but should be able to follow direction and be comfortable in a managed team environment. Agile experience or knowledge is preferred. Video streaming experience is big plus.",17,65,3,0,24,22-DEC.  -08 00.00.00,000000000,650619
85,"Senior Drupal Developer","PTG has a new opportunity in MD!We need your expertise as a Drupal Back End / Module developer who will work in tandem withÂ  UX, and development teams.Â Â Â  With strong communications skills with ability to articulate ideas with others in the teamÂ Â Required skills:Â Â Â Â Â Â Â Â  15 plus years in IT and software development;Â Â Â Â Â Â Â Â  6-10 year*s experience working on Drupal projects;Â Â Â Â Â Â Â Â  Extensive and diverse background creating custom PHP modules within the Drupal framework.Â Â Â Â Â Â Â Â  Strong background in one or more of Drupal*s major themes, i.e. Zen, Omega, etc.Â Â Â Â Â Â Â Â  Understanding of browser/client-side, particularly jQuery.Â Â Â Â Â Â Â Â  Mastery of Drupal's key contrib modules, i.e. CTools, Views, Rules, etc.Â Â Â Â Â Â Â Â  Familiarity with Drupal*s 'hook' system for modifying contributed modules remotely -- from functionsÂ Â Â Â  written in custom modules;Â Â Â Â Â Â Â Â  Background in 'site building': to be good at vetting Contributed modules from Drupal.org, installing and configuring modules for 'sandbox' projects;Â Â Â Â Â Â Â Â  Command line competence in Linux to be able to work with sandbox instances. This includes editing server files, navigating server folders, modifying permissions and other such actionsÂ Â Â Â Â Â Â Â  Familiarity with GITÂ Â Â Â Â Â Â Â  Familiarity with DB and DB Modeling * in particular MySQLÂ Â Â Â Â Â Â Â  Full Stack* development capabilityÂ Must have:Â Â Â Â Â Â Â  Experience in Public Sector environmentsÂ Â Â Â Â Â Â  Experience working in cloud environmentsÂ Â Â Â Â Â Â  W2, available for full-time",24,26,25,1,3,23-JAN.  -01 00.00.00,000000000,202385
86,"Senior Devops Engineer (Contract)","Sr Devops EngineerYour job is to understand the daily activities of our development teams and deliver solutions to make them more efficient. Listening to individuals across development, understanding their activities, and constantly thinking about ways to make it more efficient Collaborate with other Senior engineers to drive architecture of CI/CD systems. Hands on involvement in implementation of CI/CD systems. Participate in evaluating and recommending tools and technologies.Desired Skills and Experience: Focus on DevOps CI and CD solutions using various DevOps tools and frameworks Build scalable and resilient services / tools in both private and public cloud Use containers. Expertise in using containers in app build and deployment Experience in designing, building using CI tools (Teamcity/Jenkins) Familiarity with Vagrant, Mesos, Kubernetes, PaaS, Cloud infrastructure (preferred AWS) Familiarity with Log Management solutions (ELK, Splunk, Sumologic, etc) Working knowledge of build systems like Ant, Gradle and Maven. Experience coding software using object-oriented techniques (in order of preference, Java, .Net, C++, Python, other) Hands-on coding/scripting experience with bash, Groovy, python or similar Exposure to leading projects with track record of successful delivery 4 to 6 years of related DevOps experience. BA/BS in Computer Science, Computer Information Systems or related technical field. (In lieu of degree, relevant work experience). Solid communication skillsBonus Qualifications: Experience with Configuration Automation tools (Ansbile, Chef, Puppet, etc) Experience working in Kanban or ScrumPlease contact Meera Makam at 925 627 4935 or email mmakam@ascentsg.com for any questions",50,45,12,0,4,22-DEC.  -17 00.00.00,000000000,425055
87,"Capacity Planning Engineer - 11350","Capacity Planning Engineer - 11350Â Our client is an entertainment behemoth located in the heart of the worldÂs entertainment capital. Â They are a technology driven company with billions of dollars spent on their delivery infrastructure.Â  The client urgently requires Systems Architects who will architect infrastructure that scales seamlessly and will meet the growth of their services.Â Â Responsibilities:Analyze the current network and systems architecture for high performance, availability and redundancy and provide guidance on capacity optimizationWork on BMC BCO Capacity planning tool to evaluate current and future state of network and systems and provide guidance and recommendations regarding future capacity growth.Analyze requirements from the business and determine when to scale up and scale down the infrastructureCompile data from various tools (CMDB) to aggregate the data and present this to executives across the organization.Interface with vendors to resolve technical issues with their equipmentWork with various system vendors on evaluating system capacity in the video distribution network and provide recommendations. Systems include routers, switches, firewalls, load balancers, content caches etc.Engage with project teams on major initiatives to understand traffic volumes, work flows and hardware requirements to plan for adequate capacityÂ Requirements:Requires BS/BA in related discipline (i.e., Computer Science, Information Systems) and 3-5 years of experience in related field (i.e., Network Engineering, IP Video Delivery, Content Delivery Networks, Linux System Admin)Experience with BCM capacity planning tools a plusStrong analytical, budgeting and planning skillsExcellent interpersonal and communication skillsExperience developing SQL queries preferredÂ Position Logistics:Must be currently authorized to work in the USContract length: 12 monthsPosition type: ContractPosition location: El SegundoLocal candidates onlyÂ WhatÂs in it for You:Competitive pay and stable, long term contract (up to 18 months)Outstanding opportunity to make significant contributions to a high visibility team.Excellent facilities and great locationGreat opportunity to enhance or solidify your skills with an excellent and experienced team with solid expertise in this areaÂ About the Client:This client has a passion for entertainment, technology and providing unparalleled customer experiences.Â  They have a track record of continuous technological innovation that has maintained their standing as leaders in their industry.Â  They have a vibrant, fast paced environment that is the perfect place for an enthusiastic engineer to thrive in.Â About Maxonic:Since 2002 Maxonic has been at the forefront of connecting candidate strengths to client challenges. Â Our award winning, dedicated team of recruiting professionals are specialized by technology, are great listeners, and will seek to find a position that meets the long term career needs of our candidates. Â We take pride in the over 5,000 candidates that we have placed, and the repeat business that we earn from our satisfied clients.Â Interested in Applying?Send us your resume, STAT! Â Please apply below with your most current resume and anything else youÂd like us to know about you Â commute preferences, desired work environments, etc. Â We promise to get back to you within 24 hours.Â  Feel free to email Medha Haridas (medha@maxonic.com) or call 408-648-2010.Â Â Â Â Key Words: Â Capacity planning",53,50,4,0,22,22-AUG.  -24 00.00.00,000000000,213964
88,"Data Center Virtualization Architect","Data CenterÂ Virtualized Networking ArchitectÂ ResponsibilitiesThis is more of a true Data Center Engineer role as part of the Advanced Engineering (AE) team within our client. Â Required Attributes for Data CenterÂ Virtualized Networking ArchitectÂ Engineer: Solid Cisco network and Data Center architectural design and hands-on engineering experience Solid knowledge of and experience Virtualization Networking, NFV, Nuage, NSX and UCS Solid knowledge of and experience with BGP and ISIS. Strong knowledge of and experience with the implementation of Cisco Nexus data center switches, including the latest designs trends such as Leaf and Spine and *Â Â  Design, testing, and implementation of the datacenter network service to partition the data-centerRequirements Bachelors is preferred, Associates or equivalent combination of work experience is required CCIE Datacenter or Routing and Switching certification preferred, but not req*d 5+ years of experience designing and implementing Virtualized Networking and UCS.",27,48,14,0,2,22-JÚL.  -07 00.00.00,000000000,338106
89,"Procurement System Manager","PLEASE JOIN OUR TALENT NETWORK: http://bit.ly/vhatalentnetwork Joining the Talent Network with VanderHouwen & Associates (VHA) will enhance your job search and application experience. Job listings are mobile-friendly and easy to review, share, or apply. Whether you choose to just leave us your information or apply, we look forward to connecting with you. SummaryOur client is looking for a Procurement System Manager for their new SaaS solution Coupa as they roll out the solution globally.Â  ResponsibilitiesProvide subject matter expertise on core Coupa functionality and configuration.Identify opportunities and recommend possible solutions to address business needs and issues.Establish and manage Coupa change management processes, testing, and governance in line with industry best practices.Serve as day to day point of contact with Coupa on upcoming major and minor releases.Manage and foster relationships with internal and external partners.Qualifications3+ years of professional experience in SaaS change management.3+ years of professional experience in managing SaaS vendor relationships.Coupa certification or previous experience with Coupa preferred.Previous experience in procure to pay business processes a plus.Strong leadership skills; ability to lead cross-functional business and technical teams.Expert analytical skills; ability to quickly grasp complex business concepts and formulate recommendations for resolution or improvement.Skilled presenter/trainer possessing strong written, verbal, and inter-personal communication skills.Proven energy to navigate complex organizational structures.",40,48,22,0,17,22-AUG.  -01 00.00.00,000000000,227232
